{
  "schemaVersion": "1.0.0",
  "version": "v1",
  "overflowPolicy": "append-unused-then-leisure",
  "notes": "Reusable destination-day modules for the Air India CWC 2027 and Taj Holidays verticals. Plans 1-5 are ordered module ID lists; stays beyond five nights append any unused modules (e.g. Cape Town's Robben Island day) before repeating the leisure module.",
  "destinations": {
    "delhi": {
      "modules": [
        {
          "id": "delhi-arrival",
          "title": "Namaste, Delhi",
          "summary": "Land in the capital and settle in with an evening at India Gate and a stroll around Connaught Place before your onward Air India connection.",
          "highlights": [
            "India Gate at dusk",
            "Connaught Place",
            "Welcome chai"
          ],
          "image": "images/india-gate-delhi.jpg",
          "imageAlt": "India Gate illuminated at dusk in New Delhi",
          "expectedActivityHours": 3,
          "intensity": "easy",
          "kind": "arrival-light"
        },
        {
          "id": "delhi-old-delhi",
          "title": "Old Delhi heritage",
          "summary": "Explore the Mughal capital — Red Fort ramparts, Jama Masjid, and a cycle-rickshaw ride through the spice lanes and street food of Chandni Chowk.",
          "highlights": [
            "Red Fort",
            "Jama Masjid",
            "Chandni Chowk rickshaw ride"
          ],
          "image": "images/red-fort-chandni-chowk-delhi.jpg",
          "imageAlt": "Red Fort and the lanes of Chandni Chowk, Old Delhi",
          "expectedActivityHours": 6,
          "intensity": "moderate",
          "kind": "full-day"
        },
        {
          "id": "delhi-new-delhi",
          "title": "Imperial New Delhi",
          "summary": "Humayun's Tomb, the Qutub Minar complex, and a drive past Rashtrapati Bhavan and Rajpath — the ceremonial heart of the capital.",
          "highlights": [
            "Humayun's Tomb",
            "Qutub Minar",
            "Rajpath drive-by"
          ],
          "image": "images/humayuns-tomb-delhi.jpg",
          "imageAlt": "Humayun's Tomb gardens in New Delhi",
          "expectedActivityHours": 6,
          "intensity": "moderate",
          "kind": "full-day"
        },
        {
          "id": "delhi-leisure",
          "title": "Delhi at leisure",
          "summary": "A clearly marked free day — boutique shopping at Khan Market or Dilli Haat, or simply rest before the next leg of your journey.",
          "highlights": [
            "At leisure",
            "Khan Market",
            "Dilli Haat crafts"
          ],
          "image": "images/india-gate-delhi.jpg",
          "imageAlt": "India Gate illuminated at dusk in New Delhi",
          "expectedActivityHours": 2,
          "intensity": "easy",
          "kind": "leisure"
        },
        {
          "id": "delhi-onward",
          "title": "Onward connection",
          "summary": "A relaxed half-day before your Air India connecting flight, with time for the Lotus Temple or Akshardham if your schedule allows.",
          "highlights": [
            "Lotus Temple option",
            "Akshardham option",
            "Airport transfer"
          ],
          "image": "images/india-gate-delhi.jpg",
          "imageAlt": "India Gate illuminated at dusk in New Delhi",
          "expectedActivityHours": 3,
          "intensity": "easy",
          "kind": "half-day"
        }
      ],
      "plans": {
        "1": [
          "delhi-arrival"
        ],
        "2": [
          "delhi-arrival",
          "delhi-old-delhi"
        ],
        "3": [
          "delhi-arrival",
          "delhi-old-delhi",
          "delhi-new-delhi"
        ],
        "4": [
          "delhi-arrival",
          "delhi-old-delhi",
          "delhi-new-delhi",
          "delhi-leisure"
        ],
        "5": [
          "delhi-arrival",
          "delhi-old-delhi",
          "delhi-new-delhi",
          "delhi-leisure",
          "delhi-onward"
        ]
      },
      "arrivalModuleId": "delhi-arrival",
      "departureModuleId": "delhi-onward",
      "leisureModuleId": "delhi-leisure"
    },
    "mumbai": {
      "modules": [
        {
          "id": "mumbai-arrival",
          "title": "Welcome to Mumbai",
          "summary": "Arrive on the Arabian Sea — a sunset walk along Marine Drive and your first view of the Gateway of India lit up over the harbour.",
          "highlights": [
            "Marine Drive sunset",
            "Gateway of India",
            "Welcome dinner"
          ],
          "image": "images/gateway-of-india-mumbai.jpg",
          "imageAlt": "Gateway of India monument in Mumbai at dusk",
          "expectedActivityHours": 3,
          "intensity": "easy",
          "kind": "arrival-light"
        },
        {
          "id": "mumbai-colonial-city",
          "title": "Colonial Mumbai & Elephanta",
          "summary": "Gateway of India, the Chhatrapati Shivaji Maharaj Terminus, and a ferry across the harbour to the rock-cut Elephanta Caves.",
          "highlights": [
            "Gateway of India",
            "CSMT heritage station",
            "Elephanta Caves ferry"
          ],
          "image": "images/marine-drive-mumbai.jpg",
          "imageAlt": "Marine Drive promenade in Mumbai",
          "expectedActivityHours": 6,
          "intensity": "moderate",
          "kind": "full-day"
        },
        {
          "id": "mumbai-bandra-bazaars",
          "title": "Sea Link & bazaars",
          "summary": "A drive across the Bandra-Worli Sea Link, then browse Crawford Market and the Colaba Causeway for souvenirs and street food.",
          "highlights": [
            "Bandra-Worli Sea Link",
            "Crawford Market",
            "Colaba Causeway"
          ],
          "image": "images/bandra-worli-sea-link-mumbai.jpg",
          "imageAlt": "Bandra-Worli Sea Link bridge in Mumbai",
          "expectedActivityHours": 5,
          "intensity": "easy",
          "kind": "full-day"
        },
        {
          "id": "mumbai-leisure",
          "title": "Mumbai at leisure",
          "summary": "A clearly marked free day in the city — rest, optional shopping, or a Bollywood studio visit rather than a scheduled touring circuit.",
          "highlights": [
            "At leisure",
            "Optional Bollywood studio tour",
            "Cafe hopping"
          ],
          "image": "images/gateway-of-india-mumbai.jpg",
          "imageAlt": "Gateway of India monument in Mumbai at dusk",
          "expectedActivityHours": 2,
          "intensity": "easy",
          "kind": "leisure"
        },
        {
          "id": "mumbai-onward",
          "title": "Onward connection",
          "summary": "A relaxed half-day ahead of your Air India connecting flight, with time for a last coastal walk near the Gateway of India.",
          "highlights": [
            "Final coastal walk",
            "Souvenir shopping",
            "Airport transfer"
          ],
          "image": "images/gateway-of-india-mumbai.jpg",
          "imageAlt": "Gateway of India monument in Mumbai at dusk",
          "expectedActivityHours": 3,
          "intensity": "easy",
          "kind": "half-day"
        }
      ],
      "plans": {
        "1": [
          "mumbai-arrival"
        ],
        "2": [
          "mumbai-arrival",
          "mumbai-colonial-city"
        ],
        "3": [
          "mumbai-arrival",
          "mumbai-colonial-city",
          "mumbai-bandra-bazaars"
        ],
        "4": [
          "mumbai-arrival",
          "mumbai-colonial-city",
          "mumbai-bandra-bazaars",
          "mumbai-leisure"
        ],
        "5": [
          "mumbai-arrival",
          "mumbai-colonial-city",
          "mumbai-bandra-bazaars",
          "mumbai-leisure",
          "mumbai-onward"
        ]
      },
      "arrivalModuleId": "mumbai-arrival",
      "departureModuleId": "mumbai-onward",
      "leisureModuleId": "mumbai-leisure"
    },
    "johannesburg": {
      "modules": [
        {
          "id": "johannesburg-arrival",
          "title": "Touch down in Johannesburg",
          "summary": "Land in Gauteng and settle in with an evening at Nelson Mandela Square in Sandton — restaurants, city lights, and first World Cup buzz.",
          "highlights": [
            "Sandton City",
            "Nelson Mandela Square",
            "Welcome dinner"
          ],
          "image": "images/johannesburg-skyline.jpg",
          "imageAlt": "Johannesburg city skyline at dusk",
          "expectedActivityHours": 3,
          "intensity": "easy",
          "kind": "arrival-light"
        },
        {
          "id": "johannesburg-soweto-apartheid",
          "title": "Soweto & Apartheid Museum",
          "summary": "A moving day through the Apartheid Museum, then Soweto's Vilakazi Street — the only street to have housed two Nobel laureates — and the Hector Pieterson Memorial.",
          "highlights": [
            "Apartheid Museum",
            "Vilakazi Street",
            "Hector Pieterson Memorial"
          ],
          "image": "images/soweto-vilakazi-street-johannesburg.jpg",
          "imageAlt": "Vilakazi Street in Soweto, Johannesburg",
          "expectedActivityHours": 6,
          "intensity": "moderate",
          "kind": "full-day"
        },
        {
          "id": "johannesburg-cradle-humankind",
          "title": "Cradle of Humankind",
          "summary": "A day trip to the Cradle of Humankind UNESCO World Heritage Site — Sterkfontein Caves and the Maropeng visitor centre tracing 3.5 million years of human origins.",
          "highlights": [
            "Sterkfontein Caves",
            "Maropeng centre",
            "Fossil discoveries"
          ],
          "image": "images/cradle-of-humankind-sterkfontein.jpg",
          "imageAlt": "Sterkfontein Caves at the Cradle of Humankind",
          "expectedActivityHours": 6,
          "intensity": "moderate",